id,Title,Body,Category,Category_2,Category_3,Subcategory,Subcategory_2,Subcategory_3,SpecificDisorder,SpecificDisorder_2,SpecificDisorder_3
622,acupressure for anxietystresssleep issues,"hello i was reading a selfhelp book about acupressure, and came across a couple of pages related to points that are good to stimulate when someone faces issues with anxietystresssleep issues. i thought i d share it in this subreddit, as i thought people who read this now or in the future might benefit from it ) the book is in swedish, so i ll translate each page below page 64 anxiety and stress anxiety many people suffer from anxiety. most people can relate to beating afraid afraid of being attacked or to become ill, afraid of going outdoors or socialise in big gatherings etc. but anxiety is not only about being afraid. most people who suffer from anxiety have a hard time being in their own bodies when they suffer an anxiety attack. it doesn t have to be related to fear of something in particular, but can be a very unpleasant sensation in the body which is difficult to put into words. my experience is that when people get their first anxiety attack they oftentimes become very scared, have a difficult time understanding what is happening and feel at loss of power. when someone has had many anxiety attacks, they know the sensation will pass by and that it s not fatal, even though it might feel like it at that moment. it is easier to get through an anxiety attack if you have tools you can use. it helps you shift focus and helps you feel like you have more power over what is happening in the situation. therefore, it s good to know about the following points both when it comes to acute (anxiety attacks) and in preventative purpose. anxiety and stress are two states that often are related to each other. if you suffer from anxiety it s a good idea to learn more about stress, and if you stress a lot it s a good idea to learn more about anxiety. treats the points for stress, anxiety and sleep you can benefit greatly from these points page 65 stress yes but i don t feel stressed is something i often hear. but sometimes you re not aware of the fact that you re pressuring your body and mind in a way that is not good. it s easy to get lost in the things you do if you find them enjoyable, but when when you put your body under more stress than it actually can handle, a physical process starts in your body that you have no control over. it s out of your control, in other words it s run automatically and is part of the sympathies nervous system. it s also called the fight and flight system and is activated when you re stressed. there are many things that can cause stress for instance a bad workplace situation, problems in an intimate relationship, a sick child, economical struggles or if you yourself are sick. the last mentioned will also put stress on the body. if one finds oneself in a stressful state, it s like the body is in constant preparation mode. then the main focus of the organs in the body will be to increase circulation, maximise breathing frequency and increase the pulse and plops pressure. the digestion is worsening, at the same time as blood sugar is released to give the body more energy. in short, the body is in energy save mode when it comes to all body functions toons that won t be absolutely necessary in a richer or flight situation. at the same times, the functions that are beneficial during a fight or flight situation are upregulated. the sympatic nervous system helps us handle stressful situations. but if the body is the subject to prolonged periods of stress it can result in issues with, for instance, the digestion, the immune system, the circulatory system, blood pressure or blood sugar. page 66 point 14 (the stresspoint) purpose when you stimulate this point you will relax. it s one of the most relaxing points, and it helps you if you feel restless, anxious or lack concentration. the point helps to balance emotions and gives a peaceful sleep. the point is good to stimulate when someone experiences anxiety, as the treatment of this point gives improved sleep and more relaxed muscles and aids palpitations, dizziness and hyperventilation. it can also be beneficial if you feel you can t stand being in your own body, so it is good to stimulate this point when someone experiences acute panic attacks. in short, this point helps decrease anxiety in those cases there there is no obvious reason for the anxiety, and it is a good point to stimulate if you suffer from phobias. in the green box it says obs you should not use this point if you suffer from a severe heart condition. if you do suffer from a severe heart condition, use the point that is in between the tendons, which is marked with an x in the picture. you can also use acupressure beads on this point. this point is treated in the same way as the stresspoint (the green dot in the picture). page 67 left hand right hand bonus information if you use acupressure beads on these points (on the feet), the effectiveness of the stresspoint will be increased. this point (on the feet) decreases emotional frustrations, depression or suppressed anger. the point is on both feet. the point is stimulated in the same way as the stress point. page 68 anxiety point 1 purpose this anxiety point helps you attain a more positive state of mind. it is actually the most calming of all points. this point decreases the activity in the part of the nervous system that is activated when you re stressed and worries, and thereby it has a calming effect. when you are stressed, it is easier to get anxiety. and if you have anxiety you will over time become stressed, because the fight or flight system gets activated. apart from the fact that this point is very calming, you can use this point to treat all sorts of mental issues, as well as when you experience headaches or dizziness. do like this the point is on the crown of the head, in the intersection where two lines meet. 1. the line that goes straight up from the nose, forehead and top of the head. 2. make a line from the top of one ear to the top of the other ear by going over the top of the head. circulate this point calmly for a couple of minutes. note your breathing while you stimulate this point. page 69 bonus information if you massage with circular motions with the entire top of your pointer finger (when you massage anxiety point 1), you will hit four other points as well. when you stimulate these points, the calming effect still be enhanced. at the same time, these points also promote sleep. page 70 point 16 anxiety point 2 purpose the point is located right below the sternum and can be tender if you have anxiety. because this point is calming and decreases anxiety, this point is very beneficial if you experience restlessness, unease, stress and anxiety. it can also be used for treatment when simone experiences different psychological issues, for instance bipolar disorder. if you have a tendencies to become maniac or speeded, this point is the best one to stimulate. do like this find the point of the sternum (marked with a dotted line in the picture) and put the finger two finger withs below the dotted line, on the midline of the body. if you experience anxiety, you ll likely be a little bit tender here. hold this point carefully and hold still on this point for a minute. you will notice you will get more calm. repeat often and treat this point if you have an anxiety attack. obs avoid this point if you have any heart disease. page 71 bonus information after having treated this point, i recommend you do this following exercise, which can also help decrease anxiety and uneasiness. keep your mouth closed during the entire exercise. press down on one of your nostrils with one finger while you take a deep breath. move the finger to the other nostril while you slowly exhale. breathe in again slowly through the nostril you just exhaled through. move the finger again and hold down the first nostril again, while you slowly exhale. take another deep breath move the finger again and continue like this for 10 more times. page 72 point 17 anxiety point 3 purpose this earpoint is the most calming point of the ear. it has similar effects to master point 3 when it comes to the psychological aspect. the point affects our mentality and is calming and relaxing. it strengthens your kind and social sides and decreases anxiety, for instance in social gatherings social phobia or anxiety related to darkness, sickness or open spaces. when you treat this point you strengthen your ability to concentrate. treatment of this point will help against restlessness, anxiety, impatience, mood swings and sleep issues. it also helps the heart beat in a rhythmic way, if its bearing is imbalanced. if you combine this point with the bonus point below it can have a positive impact on post traumatic stress syndrome (ptsd). the point is very good if you re about to write exams, take your drivers license or experience fear related to flying because this point helps decrease anxiety. do like this the point is located in a little dent that looks like half a rowboat. the best is to use acupressure beads on this point, because you then get help with decreasing stress, anxiety and worrying for as long as the bead stays on. press down carefully on the point for at least 40 seconds, as often as you remember to. treat both ears. page 73 bonus information it s a good idea to this fantastic point that affects the nervous system in a favourable way, as it helps the body heal itself by stimulating the digestion and immune system. the point is shown in the picture above, but isn t visible on the ear since it s located on the backside of the shell of the ear. use a tool (e.g. a toothpick or lighting match) that you put along the doted line. when you cannot reach further, you ve reached the point. press this point for at least 40 seconds per day. page 74 sleep point 1 purpose this point helps improve the quality of your sleep. it can both be beneficial when it comes to falling asleep, as well as having a restful sleep throughout the night so that you wake up feeling well rested, the point also has a good effect on anxiety, nervousness and different tense states. you can also treat this point if you have a headache or an ongoing inflammation, or if you re experiencing dryness in your nose. do like this the point is situated in your forehead, in the middle between your eyebrows. put a acupressure bead on this point during early evening or late afternoon. press on the head for about 40 seconds at a time, as often as you remember to do it, for at least 34 times. take off the bead in the morning before you go to work, if you ll stay home during the day you can leave the bead in all day long if you d like. you can also treat this point without an acupressure bead by massaging with slow, calm, circulatory motions for 5 minutes as often as possible and right before you go to bed. i really recommend using a acupressure bead to keep this pout stimulated continuously. page 75 bonus information improve the effect of the sleeping point by also treating this point on the top of the foot, right underneath the nail. the point is located in both feet, you can circulate or push down repeatedly from side to side in this point. treat each toe for a couple of minutes. page 76 sleep point 2 purpose sleep point 2 helps you fall asleep more quickly and helps you sleep good throughout the night. you yourself produce your own sleeping potion melatonin. the production of this is located in the brain, in a little gland called the pineal gland. in reflexology, the pineal gland and sleep point 2 are related. melatonin is also known as the sleep hormone that makes you naturally tired and gives you a good nights rest. melatonin is only produced in darkness. that s why it s so important to sleep in a dark room. even the slightest amount of streetlight can cause confusion. if you re a woman and in the menopausal stage it is possible your production of melatonin has decreased and that you need to take melatonin in tablet form. talk to your doctor about this. do like this the point is located in the big toe, at the tip corners massage calmly with circular motions or press carefully on this point for about 1 minute, as often as you can. the point exists in your thumbs as well. treat these points the same way as on your toes. page 77 right foot left foot left hand right hand bonus information if you for instance eat parmesan, pealed sesame seeds, soja beans, aged cheese, peanut by tree, smoked salmon, tuna, pistachios or mung beans you consume the items with highest content of tryptophan. tryptophan helps the body to create melatonin, and can thereby help you get a good nights sleep. tryptophan is also necessary for the body s ability to produce the happiness hormone serotonin, which is the body s natural happy pill . the points talked about always refer to the first picture on the next page, e.g the stress point talked about on page 66 refers to the first picture on page 67. the second picture on page 67 talks about a point that s good to use in combination with the stress point. disclaimer i m aware this text makes some very big claims especially since it says it can be useful when somone has biolar disorder, mania and ptsd. do note that the text doesn t say it will cure any psychological or mental issues permanently, but rather potentially alleviate the symptoms one might experience momentarily. i can t guarantee these methods will be effective for everyone, or how effective they are, and i m not a professional. if you have psychological or mental issues, it s always best to talk to professionals of course. i don t advise anyone to only rely on these methods and not seek professional advice for their psychological or mental issues (be it anxiety, stress, sleep issues, bipolar disorder, mania, ptsd or anything else). that being said, therapy and medications can be expensive and not always at hand if someone needs help coping through a sudden and unexpected anxiety attack. these methods are very simple, easy and safe to try, and they re completely free and you can try them anywhere and any time. i do sincerely hope this information can be beneficial for somebody out there. maybe it can help someone decrease their anxiety just a little bit, or make their anxiety attacks more manageable. the methods are very easy and simple and inexpensive. if my post helps even a single person out there, it would make me so so happy. i wish you all the best take care )",Anxiety Disorders,Trauma & Stressor-Related Disorders,Mood Disorders,Panic Disorders,Adhd,Ocd Spectrum,Panic Disorder,Narcolepsy,Alcohol Use Disorder
9243,how to have a healthy dynamic,"so i (27 nonbinary) recently started talking with someone who has dpd. met on hinge but we are not a couple, not even friends yet. very much in the talking stage. i'm researching what it is and how it affects them on my own, but what i cant find is a good answer on how to build a healthy dynamic with them if we were to become friends or whatever (heck maybe even nothing but i do want to be informed at the least). my fearsquestions are is it bad to be depended on? if so, how to avoid becoming depended on while still being a source of support? scared of hindering her therapy work and self work. any pitfalls i should be aware of that nondpd havers do to dpd havers? should the nondpd haver try to encourage them to make their own decisions or is there a middle ground that is healthy? any other pieces of advicepersonal experiences you wish you could share to nondpd havers so they can best navigateunderstand what you guys go through each day? sorry for the long post. its 4am cant sleep cuz im sick and cant do much other than overthink so thank you in advance.",Personality Disorders,Substance-Related & Addictive Disorders,Obsessive-Compulsive & Related Disorders,Cluster C (Anxious/Fearful),Restrictive/Compensatory Disorders,Insomnia Spectrum,Dependent Personality Disorder,Anorexia Nervosa,Narcolepsy
14796,social anxiety,i'm aware of my intellectual ability to accumulate words but they can't come out as i'm having a conversation instead i sound dumb and arrogant which cause people to have the wrong perception of me they think i'm dumb because of my lack of social skills how do i defeat this monster from within it's been destroying me for years i wanna be me again,Anxiety Disorders,Trauma & Stressor-Related Disorders,Substance-Related & Addictive Disorders,Generalized Anxiety Disorder,Bipolar Disorders,Insomnia Spectrum,Generalized Anxiety Disorder (Gad),Social Anxiety Disorder,Adjustment Disorder
21556,is it possible to feel normal or just act normal?,"i ve been diagnosed and it s a little more than 9 months that i ve been on meds prozac, xanax and rivotril. i pushed myself since my attempted suicide and being placed in a psychiatric ward i got into my dream university and i got friends and it s cool. college is about having fun and experimenting. going to parties and getting drunk. just life. halloween is coming up and my friends are planing to go to a halloween party and i can t, because i don t have the self control to not drink alcohol and if i do i will get fucked up. can i have fun being sober surrounded by all my friends drunk? and it s not like i could even be the designated driver because i m not cleared to drive. do i go? i feel like i d be a buzz kill.",Mood Disorders,Personality Disorders,Substance-Related & Addictive Disorders,Depressive Disorders,Phobias,Substance Use Disorders,Persistent Depressive Disorder (Dysthymia),Schizoaffective Disorder,Antisocial Personality Disorder
6774,impending doom.,"does anyone else imagine a whole scenario of them getting a heart attack, and what happens next to them death and all?? like whenever i get a weird sensation i just imagine dying and that im having a heart attack or my body is collapsing . is this normal or am i actually dying???",Anxiety Disorders,Personality Disorders,Mood Disorders,Panic Disorders,Generalized Anxiety Disorder,Ptsd Spectrum,Panic Disorder,Adjustment Disorder,Seasonal Affective Disorder
18289,grieving everything i lost due to this. how do i have less stigma towards myself?,"i think it's been 11 years? maybe 12 since my diagnosis. if i didn't have it when i was diagnosed, then i definitely had it 67 years ago. since then, it's been such smooth sailing that i gradually forgot it was a legitimate problem, since i've been on medication for that time. in the past 8 months i've lowered my dose from 400 to 300, started developing more ocdlike symptoms, and then slowly persuaded myself that the doctors were wrong, and that i had some other, more benign disorderdisease instead. then i read my old journals and i was like ""oh... these are incoherent."" i still knew what i meant by what i wrote, (after all, i'm still me) but i had enough distance from myself to know that other people would surely find them incoherent. there are so many confusing things about myself that i can't begin to cover in detail, but i also have problems with my vitamin levels and if i take thiamine (b1) for a few days regularly, then my symptoms disappear or lessen considerably, i've had several head injuries as a child and i wonder what really caused this or if i really have this disorder, or that, or if it's just trauma, since my symptoms were at their worst following an assault, or... you get the picture. doctors always say i have good insight, because i always know what's a hallucination and what's not, even when i'm having one, but that's probably just because my hallucinations aren't very real. and guess what? all the insight in the world doesn't make them go away. so it's a moot point. as i try to hold onto my insight, i am faced with the question of regardless of what it is or isn't, there are still things i can't do, and never will be able to do. i'm in grad school and looking forward to holding a professional, stable job, after never working substantially. i've lost years, and i'll probably never be able to have children, because of this. my grandmother's prayer for me was that god would ""restore the years the locust has eaten,"" and i'm sure it will happen, but i still don't see myself starting a family or getting married because how can i have a relationship when i'm stuck inside my head? how can i meaningfully connect with someone when i'm so medicated that i feel apathetically about everything around me? if the label doesn't fit, then i won't bother stretching it. but i'm beginning to realize that it probably does fit and i have too much stigma against myself. i'm still going to try to get my doctor's blessing to lower my medication further, but i don't see myself being medication free. why am i embarrassed and bitter about being on these injections? more importantly, where do i go from here to have less stigma against myself?",Schizophrenia Spectrum & Psychotic Disorders,Mood Disorders,Sleep Disorders,Psychotic Disorders,Insomnia Spectrum,Panic Disorders,Schizophrenia,Bulimia Nervosa,Generalized Anxiety Disorder (Gad)
13851,same song on repeat?,"so, i've never been formally diagnosed with cyclothymia, but i am the adult child of a parent with bipolar ii. i feel like i have highs and lows on the reg, and pretty much have my whole life. my question is this do any of you ever play the same song on repeat when you are starting a cycle of mania? the last song i noticed this to was ""orinoco flow by enya"". i must have listened to it at least a dozen times in a row. i noticed this pattern a few months back after all these years, and i wondered if any of you experience this before the sads come on. btw the sads aren't super sad, just a feeling of hopelessness and general sadness. thanks for reading",Mood Disorders,Trauma & Stressor-Related Disorders,Substance-Related & Addictive Disorders,Bipolar Disorders,Ocd Spectrum,Adhd,Cyclothymic Disorder,Binge-Eating Disorder,Seasonal Affective Disorder
11170,methadone startup,"doc and i finally decided to start methadone after everything else finally failed for me. 2.5 as i taper gabapentin and cannabis (almost at zero now) and green light for 5mg. so, question... i start feeling crappy in the afternoon, need to nap badly. anyone have a similar experience? when can i expect this to normalize, if at all and reach a steady state?",Sleep Disorders,Mood Disorders,Schizophrenia Spectrum & Psychotic Disorders,Insomnia Spectrum,Depressive Disorders,Cluster A (Odd/Eccentric),Restless Legs Syndrome,Histrionic Personality Disorder,Schizoaffective Disorder
274,4 hours and 11 minutes after midnight,"a poem about my experience with insomnia. 4 hours and 11 minutes have elapsed since midnight, all awake. it is not by choice i stay awake but choice or not i am here. unconsciously, continuously i suffer awake unable to rest even through rest i rest not easy for the morning brings uncertainty to wakefull rest. i yearn for sleep unable to choose when i may slip away to dreams untold. but dream i do not. dark thoughtless nights await me as my brain tries its best to recover through this endless cycle. when sleep is achieved it is not my choice, but chooses by force my body does, eventually i do sleep. sleep i do deeper than most but most struggle not to sleep sweet slumber. awake i lay perpetually perplexed at the painful reality that ponders sweet pain. i do not desire sleep, i yearn for it hoping for one restful night i may rest my eyes to wake with the ability to do it again. unfortunately for me that is not the case so here i lay loft looking at the ceiling in the low light suffering. it is not by choice i suffer alone, solemnly sought after sleep so desperately, i hope one day i may suffer no more.",Sleep Disorders,Neurodevelopmental Disorders,Schizophrenia Spectrum & Psychotic Disorders,Insomnia Spectrum,Generalized Anxiety Disorder,Phobias,Insomnia,Schizotypal Personality Disorder,Paranoid Personality Disorder
2805,diary checkin the cold snap,"i guess this post is a little diary checkin as we re getting through the last months of winter. this is what my forecast is showing now (added both c and f so that everyone understands). honestly, when i saw this i initially felt really down, but i guess it isn t the worst. at least it s better than temperatures around zero with sleet and gray skies. this thursday i m starting my spring semester at university, and this is definitely not the greatest beginning to it weather wise. the winter break has been quite pleasant, though i had 0 chances to engage with my hobby (amateur astronomy) because it was cloudy nearly 247. on the upside, our local weatherman said spring will be early this year (which means snow might begin to melt around march 15, which is quite early). how are you all doing nowadays? are you finally getting more sunshine or is it still bleak?",Mood Disorders,Neurodevelopmental Disorders,Eating Disorders,Depressive Disorders,Panic Disorders,Ptsd Spectrum,Seasonal Affective Disorder,Histrionic Personality Disorder,Cyclothymic Disorder
