id,Title,Body,Category,Category_2,Category_3,Subcategory,Subcategory_2,Subcategory_3,SpecificDisorder,SpecificDisorder_2,SpecificDisorder_3
14122,"selfdoubt, embarrassment, and anxiety in a college context","i've been doubting myself and carrying a lot of shame lately. it's gotten to the point where if i have an interaction with someone i really respect, like a professor or peer, i'll either replay the moment over in my head visciously to make sure i didn't say something wrong, or try to completely forgetignore the interaction for fear of realizing i said or did something that's really embarassing. social anxiety has always been something i've struggled with, and i've always ruminated on embarassing moments, but it's just been feeling amplified. for example, i had a meeting with a teacher of mine who expressed interest in the work i did on a class project and told me that they want to keep supporting my developing efforts during the rest of my time as a student. i feel i prepared a sufficient amount to answer any questions they may have about my project's progress, but throughout the meeting i had a lot of internal moments where i wasn't sure if i was saying the ""right"" thing. (i haven't the slightest clue what would be right in this scenario, but i still that i was invariably wrong somehow.) the whole situation required a heightened level of vulnerablity due to the kind of feedback they had to give. i felt as if i was flailing, especially in my responses to them. they were incredibly nice and supportive the entire time and never said a rude or disparaging comment, but a part of me still worries that they'll regret choosing to commit to spend time helping me, that they mind will change and they'll think that i'm not as collected, smart, and capable as she thought. there's a very loud voice in my head telling me that if they do continue to support me, it would be out of pity, obligation or goodwill. the worst part is, i know that if i continue to think this way it will just become a selffulfilling prophecy, but i can't help it. a part of me feels as if i've already done too many humiliating things, that i've made too many irreconcilable mistakes in life. mind you, i'm 21. i know that my life is far too short to judge myself this harshly, yet i still do. since entering public school in 8th grade (i was homeschooled for most of my elementary and middle school years), the harsh critic in my head has been so hard to turn off, despite all the really cool things i've accomplished that i'm proud of. recently, their voice has been deafeaning. i'm choosing to write about this experience because i noticed that i began feeling my chest tighten at the thought of reviewing the feedback my professor gave me for my project, which i know won't do me any good in the long run. i will ultimately feel even worse if i let my project flounder because of my low self esteem. i'm hoping this public journal entry will help me begin to parse out why i find myself so unforgivable, and maybe also make someone else feel less alone with their thoughts. i also think it's worth reminding myself that everyone does humiliating things. sometimes it feels like only i feel things as strongly as i do and that i somehow am the worst person in the world. i forget that everyone else is dealing with their own problems, and my mistakes, general social awkwardness, or flounders are not (or at least should not be) the center of anyone'a concern.",Anxiety Disorders,Substance-Related & Addictive Disorders,Eating Disorders,Generalized Anxiety Disorder,Panic Disorders,Cluster C (Anxious/Fearful),Generalized Anxiety Disorder (Gad),Schizophrenia,Schizoaffective Disorder
20471,i hate myself for the way i look,"for context i m a 17 year old girl. to be as frank as frank can be.. i have body dysmorphic disorder, in the sense that i m completely obsessed and fixated on the flaws of my bodyface. it goes much deeper than regular body insecurities go. it s all i think about, day and night, most recently.. even in my dreams. there s quite literally no break from my thoughts about imperfection. i can t take a picture without deleting it immediately. i dread going to the bathroom, because there s a large mirror that covers most of the area, and i ll have to accidentally get a glimpse of myself, who i deem hideous. so as you might think.. i do try to avoid the bathroom.. the thing is.. i know i don t look all that bad.. i don t have any skin problems, nothing is awfully too over exaggerated.. everyone says i look pretty, but i can t help to disagree and hate myself. i often will hurt myself because i think i deserve it for looking so awful. i ve tried makeup before but it was only minimal. at first i was pleased.. then my thoughts set back in and i was ugly once again. now i don t bother with makeup because i ll be ugly either way, or i ll be fake. i don t think this way about others, only when it comes to me. i m in so much emotional pain over this. i cry myself to sleep some nights due to the fact i hate myself for looking this way. my question is.. for the people who may have body dysmorphia in the same way i do, or maybe those who are just terribly insecure.. how have you handled it? or how are you handling it? a little more information here.. i have tried many anti depressants, and i m not interested in medication any longer. and.. my body isn t the only thing i stress about. i have a big problem with my voice as well. i can t stand how i sound, like a 10 year old.. but i do know there s not much that can be done with thaat. better than sounding like a 50 year old smoker amiright? i tell myself..",Obsessive-Compulsive & Related Disorders,Sleep Disorders,Trauma & Stressor-Related Disorders,Ocd Spectrum,Insomnia Spectrum,Autism Spectrum Disorders,Body Dysmorphic Disorder,Bipolar 1 Disorder,Cannabis Use Disorder
19121,hypnic jerks anyone?,"a couple weeks ago i started experiencing really gnarly hypnic jerks after some food poisoning made it super difficult to sleep. and since then i've started getting them more frequently. they're awful. full body jerks. it feels like my tourettes tics. like i could suppress them, but it's like trying to hold in a sneeze and won't relax until i let it happen. how the hell does one manage these? i can't sleep, and narcolepsy insomnia is already bad enough. of course i can't say with 100% certainty that they're hypnic jerks and not some other neurological horsefeathers, but that seems like a good place to start...",Sleep Disorders,Obsessive-Compulsive & Related Disorders,Personality Disorders,Insomnia Spectrum,Substance Use Disorders,Depressive Disorders,Narcolepsy,Insomnia,Paranoid Personality Disorder
14076,seeking support for binge eating habits,"hello everyone, i'm reaching out to this community in hopes of finding support and guidance for my struggle with binge eating. due to financial constraints, i'm unable to seek professional help at this time. since my teenage years, i've developed a routine of eating at specific times, regardless of hunger. this habit has led me to eat even when i'm already full. additionally, i've noticed that i tend to eat in response to various emotions whether i'm happy, sad, bored, or angry. eating has become my goto coping mechanism, and i'm finding it challenging to break this cycle. has anyone else experienced something similar? what strategies or approaches have helped you manage or overcome these habits? any advice or shared experiences would be greatly appreciated. thank you for taking the time to read my post.",Eating Disorders,Neurodevelopmental Disorders,Obsessive-Compulsive & Related Disorders,Restrictive/Compensatory Disorders,Phobias,Insomnia Spectrum,Binge-Eating Disorder,Seasonal Affective Disorder,Cyclothymic Disorder
18872,help,"so the days before my period i feel low and all i wanna do is order 3 fast food portions and eat, bake cookies and eat loads of carbs and chocolate. just be by myself and eat. normally i never crave carbs and sugar. had been thinking of pasta for 3 days and yesterday i binged almost 4k calories. had been doing really good for 8 days but relapsed. also i m so hungry, i have no stop beside my stomach is aching. do any of you have suggestions how to cope with all cravings and low self esteem and bad mood the days before period? those days always turn me to binge eating.",Eating Disorders,Obsessive-Compulsive & Related Disorders,Anxiety Disorders,Restrictive/Compensatory Disorders,Depressive Disorders,Insomnia Spectrum,Binge-Eating Disorder,Cyclothymic Disorder,Schizophrenia
8862,feel like a complete failure at 27,"hey everyone. i m 27 and i feel like a total looser. sometimes i feel like i m still 14 years old mentally and i ll never achieve anything in life. i ve moved to canada in 2018 to study and eventually get a job and apply for pr. i ve graduated two years later with a useless diploma and the only job i was able to get was a dead end, minimum wage manufacturing job. i worked there for two years until i couldn t stand it anymore. so i ve moved to another province hoping it would improve my situation. now i work a construction job which i don t particularly hate but i know i ll not be able to do it for long. not that i ll even have to though, my work permit expires this summer and i ll not be able to apply for pr because i don t have one year of skilled experience. i have a massive credit card debt which i ll never be able to pay off but it s not like i ll ever get a chance to return to canada anyway. i ve been trying to break into game development industry because i enjoy making 3d models for games but considering how the industry is right now and with ai improving every day, i don t think i ll ever find a job in that field. i have a supportive family so when i get back home i ll be able to relax a bit, i ll not have to look for a job right away. but i ll have to find some kind of job eventually. i just feel like i ll end up working a lowest paying job for the rest of my life because i don t have any valuable experience and my education is completely useless. i m also socially awkward so it makes everything worse. i always thought i d have some kind of career by now, good income. but here i am absolutely broke, spent a lot of family s money on a useless diploma, haven t achieved anything in life. working 10 hours a day outside in a cold, sometimes 6 days a week. i don t even know why i wrote this, i guess i just had to share my feelings with someone.",Mood Disorders,Obsessive-Compulsive & Related Disorders,Eating Disorders,Depressive Disorders,Insomnia Spectrum,Ocd Spectrum,Major Depressive Disorder,Bipolar 2 Disorder,Social Anxiety Disorder
3180,do weekdays vs weekends have strong effects on your mood?,"i m not diagnosed with anything other than adhddepression and i have very strong indicators for a mood disorder per a nuero psychiatrist evaluation and an agreement from my long time pediatrician (18 year history) i m 33yo and have been exploring this mood stuff after being diagnosed as bipolar 2 in my early adolescence and then having my primary order psych evaluations to confirm that but it wasn t confirmed and was brought into question so they stopped considering bipolar 2 per the results. my wife who s been with me for 17 years agrees with the mood disorder but not bipolar 1 or 2 because as she puts it, it s like walking on eggshells daily with me and some things just send me into a complete anxiety mess usually angry and irritable which is intense and quickly brings me to seek out isolation and then i become depressed. all of this seems to happen much more on the weekends and much less during the weekdays. my thoughts are that routine does good things for my mood, when the weekend is gone that scaffolding holding me together is gone too. the chaos and unpredictability of my life at home with an almost 3 yo and 1 yo is chaotic by nature very small things seem to set me on a path of intense irritability that can sometimes be a couple days or sometimes even just half a day. my adhd meds i ve started taking 4 months ago or so is giving me th ability to see this more clearly and spot patterns and from what i have been reading there is a lot of overlap with adhd and mood disorders, particularly with cyclothymia and bi polar. i sort of live my life trying to regulate this by trying to determine how strongly my mood or emotions are in the moment, if they seem balanced or grounded i often feel a bit dull but ok, if they are strongly positive, especially like i m beaming light and on top of the world i need to be very aware because that seems to be when a shift in life can direct that 1000 gigawatt toward anger and self loathing, on the same end if i feel down like really bad, questioning life and beating the shit out of myself without even knowing via rhuemimation over dumb stuff i need to remember to bear down and take it because it s not for ever and to let my wife know because it s not an excuse but it s for her to know why behavior may be influenced by a mood and my feelings may not truly represent how i feel about a subject, person or thing.",Mood Disorders,Neurodevelopmental Disorders,Trauma & Stressor-Related Disorders,Bipolar Disorders,Cluster C (Anxious/Fearful),Adhd,Cyclothymic Disorder,Post-Traumatic Stress Disorder (Ptsd),Avoidant Personality Disorder
6576,"idk if this is common but i am all scattered ,in a fog of purple void","i am losing my grip on life and everything that ties me to it and now finally after a sleepless night and 21 hours awake i am collecting pieces together. i caught a virus although it was lingering in background for a few days,i lost my will to eat even though i feel hunger at some point. i have so much that i need to do and yet i have absolutely none motivation for it .... apathy is eating me from inside and i know what i need to do but for some reason i'm just watching the house burn ???? i needed to get this of my chest somewhere where it will be understood as in my nonexistent circle everyone gets it wrong or doesn't understand my woes. idk what am i going through at the moment but i struggle with my own self ,i don't know where the fuck i am and i need me cus so much shit is going on right now ....but i'm fading away just rambling at this point , gotta pay off some sleep debt ,if you have any literally any advice how to peice myself together i'd appreciate it . just venting here makes it a lot more bearable.",Personality Disorders,Neurodevelopmental Disorders,Schizophrenia Spectrum & Psychotic Disorders,Cluster A (Odd/Eccentric),Cluster C (Anxious/Fearful),Adhd,Schizoid Personality Disorder,Attention-Deficit/Hyperactivity Disorder (Adhd),Post-Traumatic Stress Disorder (Ptsd)
8354,obsessed with being the main character,"every single moment i'm not ""the main character"" feels like hell. being around super confident people makes me shrivel. i want to be the loudest in the room, the flashiest, number one. but in casual conversation you can't always be the focus can you?? i want to be a leader, a hero, the one everyone's talking about when i'm not in the room, both positively and negatively. it makes me feel awful. i feel like a side character in my own life, just some spiteful prick always lagging behind people who play that role better without even knowing it. does anyone else get this feeling often? (that one will wood song triggered it to get wayyy worse as of the last few months lmao)",Personality Disorders,Eating Disorders,Obsessive-Compulsive & Related Disorders,Cluster B (Dramatic/Emotional),Restrictive/Compensatory Disorders,Adhd,Narcissistic Personality Disorder,Obsessive-Compulsive Disorder,Major Depressive Disorder
16276,does vyvanse insomnia go away?,"i can't sleep on this medication it works well during the day but at night its' a nightmare, i just lay in bed praying that i can fall asleep.i only sleep about 45 hours a night since starting last week, i also feel like its messing up the efficacy of the medicaiton as well. so i'm hoping that overtime it does go away",Neurodevelopmental Disorders,Sleep Disorders,Schizophrenia Spectrum & Psychotic Disorders,Adhd,Bipolar Disorders,Substance Use Disorders,Attention-Deficit/Hyperactivity Disorder (Adhd),Schizoaffective Disorder,Persistent Depressive Disorder (Dysthymia)
17412,fellow northerners we re almost there,"march 1st means it s starting to finally wind down the end of another horrible winter is on the horizon. this has been a particularly cold and snowy winter, with weeks below zero and virtually no sun. it may not feel like it, but spring is just 19 days away. soon enough, it will be summer, and we will feel like ourselves again. we did it, folks. we did it.",Mood Disorders,Substance-Related & Addictive Disorders,Trauma & Stressor-Related Disorders,Depressive Disorders,Insomnia Spectrum,Ocd Spectrum,Seasonal Affective Disorder,Delusional Disorder,Agoraphobia
2542,day after a binge again.,"today is march 4th, binged last night and ate so much . i feel terrible and gross and i have school today. but i feel more determined to stop cuz i actually told my sister about it everything abt my bed. i have been eating only very little for lunch and breakfast but a lot for dinner or binges. my staples for lunch is either a cereal bar or a convenience store chicken breast. this is prob restriction. but i can t get myself to eat smth else at school. this is def one of my reasons that i binged sometimes i skip lunch. but i would eat a lot for dinner and i still binge idk why she said she would help me and i m convinced she can. ok im going to start good next week.. i ll try to implement more for lunches and hopefully the binges will stop. i don t even know why i binge bro like this is so annoying.",Eating Disorders,Personality Disorders,Schizophrenia Spectrum & Psychotic Disorders,Restrictive/Compensatory Disorders,Bipolar Disorders,Insomnia Spectrum,Binge-Eating Disorder,Schizoid Personality Disorder,Body Dysmorphic Disorder
3783,hlep with understanding hallucinations,i have experincesing vsuial hallucinations now for about a year i belive i have had it sinces i was chlid now looking back on it but hallucinations used to just have four the nice ones are the women all in white one with faces aurond the head and one that dosent have a face and two men like voide black who are the sacry ones but i have rescently devloped one after going thourgh traumic event i was just wondering if that is normal to devleop more,Schizophrenia Spectrum & Psychotic Disorders,Sleep Disorders,Anxiety Disorders,Psychotic Disorders,Generalized Anxiety Disorder,Ocd Spectrum,Schizophrenia,Alcohol Use Disorder,Narcolepsy
20885,i m a failure and i don t know how to keep pretending i m not,"i don t know what s wrong with me. for over a year i have been applying to jobs and have gotten nothing but rejection emails, not even for any kind of highly specialized positions, just cashier jobs. i have all the qualifications and experience for the majority of the jobs i m applying to and i m actually overqualified for many of them as well, but no one seems to want me. i took a gap year to focus on my mental health which makes me feel like i m falling behind everyone else i know who are going off to university from their community colleges and i can t even put the fries in the bag. not only that but i m in a lot of credit card debt. i owe about $1.5k and don t even have a job to pay it off, so all it s doing is tanking my credit score. at this rate i ll never even be able to get an apartment with how low it is. with everything going on it s been making me so stressed i keep wanting to eat. i ve gained so much weight in the last 7 months over 50 pounds. i look hideous. i see other 18 y.o girls and they still have perfect thin bodies they ve had their whole lives with 0 stretch marks and back rolls and it makes me feel even worse about myself. they look young and lively and i look dead and miserable. i ve got so many stretch marks you would ve thought i had 3 kids. in all honesty it s hard to think my bf still finds me attractive. we met when i was only 150 and now i gained over a third of my former body weight. it s insane that he actually cares to be intimate with me in any way, but i don t actually let him. i m so disgusted with myself i can t even look down when i shower. i cry all the time because everything in my life has gone so wrong. i m a failure and i don t know how to keep pretending im not. i m not a good student, i m not a good worker, i m not a good girlfriend, and i m not a good daughter. with everything going on it makes me wish i would have taken my life back in april of last year how i could have avoided all of this is i had just done it then and there. but now i m here and i can t say it was for the better.",Mood Disorders,Obsessive-Compulsive & Related Disorders,Neurodevelopmental Disorders,Depressive Disorders,Cluster A (Odd/Eccentric),Bipolar Disorders,Major Depressive Disorder,Schizotypal Personality Disorder,Restless Legs Syndrome
21952,is this the beginning of something or just a mental spiral?,"hi everyone, i m not sure if what i m experiencing is related to schizophrenia, so i wanted to ask what the first signs were for you. i m not really experiencing fullon auditory hallucinations, though i occasionally hear random voices or sounds that i can usually rationalize but sometimes i m still left uncertain. visually, i see repeated patterns like faces or shapes, but rarely actual figures. i do, however, often sense figures around me mostly to the sides or behind me though they disappear the moment i try to look. i ve also been going through intense derealizationdissociation episodes. they re so frequent that i can barely hold conversations anymore without questioning if the people around me even my partner, family, and close friends are actually real. my sleep is extremely disturbed, and my dreams are repetitive and panicinducing. no matter how much i sleep, i always wake up exhausted. lately, i ve started questioning everything even myself and it s getting to the point where i feel like i m living in some vivid dream or simulation that i ll eventually wake up from. my memory has also gotten really vague, though i can still recall names very well. has anyone experienced anything similar early on?",Schizophrenia Spectrum & Psychotic Disorders,Sleep Disorders,Trauma & Stressor-Related Disorders,Psychotic Disorders,Ocd Spectrum,Panic Disorders,Schizophrenia,Seasonal Affective Disorder,Panic Disorder
