id,Title,Body,Category,Category_2,Category_3,Subcategory,Subcategory_2,Subcategory_3,SpecificDisorder,SpecificDisorder_2,SpecificDisorder_3
14294,shitty day that ended mental breakdown over a in appropriate touch by an older woman. am i over reacting ?,"tldr at bottom. eng is not my first language sorry. full disclosure i (f20) have had many incidents since childhood of ""inappropriate touches"" by men mostly. had completely lost my mental health during covid. am very paranoid about people touching me in general and diagnosed with anxiety and depressive symptoms by a psychiatrist. take medicine too. a psychologist also described me as having repetetive obsessive thoughts (the o from ocd) my college group thrust a really long task and it's ppt completely upon me yesterday cause i missed the last presentation (but still did all my work for it) did it alone through the night, didn't sleep. woke up, couldn't find my favourite bra for the third day. started crying a little at the washing machine. my commute to college is around 1 1 hrs by carauto and local train , with 46 hrs in college and 1 hr travelling back and i really want to be comfortable through this hell.my class starts at 730 am. i asked my mom to cook me instant pasta for college. she is also recovering from surgery and is frustrated. when i was leaving , i asked her to just give me whatever was cooked and she anuched into shouting taunting at me later i felt bad and i apologized to her in a message too. 2 classes later , 4 hrs in college the day wasn't really going bad. we have to select our minor subject to study for next 3 yes and i wanted to ask a faculty from a certain department whoose program i am considering about it. find the older lady professor, grey hair old, probably 5060 and she is from fashion design, and in a crowded room where some fashion couture ka photoshoot is going on. she wants me to see a really well crafted top a student is wearing as an example. and all of a sudden i feel fingers jabbing at my boob from the side i think oh ""she wanted to grab my arm and missed"" and instinctively moved away from her . she is looking away from me and towards the student she does it a second time"" . i have trained myself to shovehitshout at men in these kinds of situation, but this was a female proffesor in full room and i just froze and didn't raise my voice even i moved away and she finally , without touching me, points out the student she wants me to see. i continue my discussion with her in a normal voice , but my panic had already started atp. i kept thinking ""did she do it on purpose or am i over reacting ??"" "" did she try to molest me "" ""am i completely crazy for thinking a 6070 yr old woman would try this ?"" all of my trauma came back i think. cried in the washroom, cried through the next class, left in the middle of class saying i am not well and came back home and for the last two hours , i just lay in my bed and howled and cried my lungs out. i hate men but i wanted to be held and sothed by a man, or even my mother so desparately tldr have childhood trauma , sleep deprived , shitty morning , grey haired older female proffesor pokes jabs fingers into my boobs twice , have a mental breakdown. have i gone completely crazy and overreacting ? how do you determine if a touch is accidental or intentional ?",Anxiety Disorders,Mood Disorders,Schizophrenia Spectrum & Psychotic Disorders,Generalized Anxiety Disorder,Panic Disorders,Substance Use Disorders,Generalized Anxiety Disorder (Gad),Autism Spectrum Disorder (Asd),Antisocial Personality Disorder
4998,how the fuck am i supposed to do this whole life thing when i can t help but get into conflicts with anybody i have any sort of relationship with ??,half rant half serious question . i m 21 now so the freedom to pick and choose who i spend my time with has opened up my antisocial behavior to a ridiculous extent. i want to have friends and romantic relariosnips but i just cant. my competitiveness and feeling of self importance always ruins it every time.,Personality Disorders,Eating Disorders,Sleep Disorders,Cluster B (Dramatic/Emotional),Autism Spectrum Disorders,Phobias,Antisocial Personality Disorder,Seasonal Affective Disorder,Bulimia Nervosa
21025,i m not allowed to run anymore,"i'm actually about to cry right now. my doctor said my heart rate and blood pressure are too low for cardio and i know my mother will enforce this. i'm not even that underweight, i look normal, just fit. and now i'm crying i love running and working out so so much and now i can't. sorry i know this has no purpose i'm just ranting because i'm so sad and i know the people i know won't understand.",Eating Disorders,Neurodevelopmental Disorders,Sleep Disorders,Restrictive/Compensatory Disorders,Ocd Spectrum,Depressive Disorders,Anorexia Nervosa,Delusional Disorder,Bipolar 1 Disorder
3796,hoarding bedroom,"so my dad is a hoarder, and i have depression. well gaining hoarder tendencies from him and having depression dosent go very well with a room. well i have multiple of those three drawer plastic drawer things u buy at walmart and a rocking horse i was redoing and never finished, what can i do with these? if i leave them on the street will the trash get them? also have a broken book case that fell ontop of me and broke in half, is that somthing i could leave on the curb too? i ve been cleaning my room for a week now daily and nightly so my curb has consisted of a ton of trashbags so i m not sure what can all be left out there and stuff",Obsessive-Compulsive & Related Disorders,Eating Disorders,Mood Disorders,Ocd Spectrum,Generalized Anxiety Disorder,Cluster A (Odd/Eccentric),Hoarding Disorder,Sleep Apnea,Histrionic Personality Disorder
8308,novel with avoidant character,"fellow avoidants, i am publishing a novel on november 10th and the main character has avpd (like me). i would love to get opinions on how well the condition is portrayed in the book. bear in mind, the book is a forensic mystery and is not about avpd, per se. but the main character's struggle with it is part of the story. if anyone is interested in getting a free copy of the ebook, here is a link. i only ask that you dm if you have feedback. i have limited this offer to 25 books, since the book is going on sale next month. if this type of post is not allowed i will take it down. but since it is difficult to find avoidants portrayed in books and other media, i thought it would be of interest. here is the link [httpsdl.bookfunnel.come057d7ncij](httpsdl.bookfunnel.come057d7ncij) x200b edit thanks to all those who upvoted andor downloaded the book. i look forward to your feedback.",Personality Disorders,Obsessive-Compulsive & Related Disorders,Trauma & Stressor-Related Disorders,Cluster C (Anxious/Fearful),Cluster B (Dramatic/Emotional),Ptsd Spectrum,Avoidant Personality Disorder,Binge-Eating Disorder,Seasonal Affective Disorder
11894,other people dieting and working out,"how do you all deal with other people around you dieting and working out? with people at work, it s not such a big deal for me because i wfh so i don t have to be around the talk really. sometimes it ll come up in the chat, but it s always short lived. but my partner just started training for a long distance walk the way they talk about the walks, needing to walk a certain distance or for a certain timeframe, it triggers me so much. i feel competitive and like shit basically because i m not working out at all. i talked to them yday about it, but i don t have a solution for it. i can ask them to not talk to me about it, but it s important to them and i know they re doing it anyway, so i ll still be triggered and i ll know things are being kept from me i am trying to get into recovery, but the healthcare system is shit and it s been over 2yrs and i ve still not actually started therapy properly. i don t have any support really, and i think i d be able to better handle it if i had a treatment team or something. but atm i m in limbo, waiting for treatment and idk how to handle this.",Eating Disorders,Schizophrenia Spectrum & Psychotic Disorders,Neurodevelopmental Disorders,Restrictive/Compensatory Disorders,Bipolar Disorders,Psychotic Disorders,Anorexia Nervosa,Seasonal Affective Disorder,Social Anxiety Disorder
20370,i had that realization this morning,"that i and no one around me really matters none of this matters. before it used to make me sad now i m literally just tallying the days on my calendar, i see each day i get through as a day closer to death. i find nothing enjoyable about existence whatsoever. socializing and being forced among society seems like a form of mental slavery to me there is no alternative or exit strategy to any of this. you are force into what situation you are born in and then life will take and take from you until you have nothing left. i have been in a situation where i tried to end myself i could never pull through with it so now i sit in isolation and play the waiting game until i draw my final breath .",Personality Disorders,Substance-Related & Addictive Disorders,Anxiety Disorders,Cluster A (Odd/Eccentric),Cluster C (Anxious/Fearful),Restrictive/Compensatory Disorders,Schizoid Personality Disorder,Sleep Apnea,Major Depressive Disorder
17137,feel like i am constantly faking everything,"i feel like i am faking my job i feel like i am faking being schizoaffective i feel like i am faking bipolar symptoms i also feel like i fake having auto immune diseases. does anyone else struggle with this constant nagging voice telling you everything you do is fake and you are a liar it's driving me crazy, i keep telling myself why would i even want to fake these things? who would want to fake this shit? i have no financial gain or any thing beneficial coming from this, so why would i be faking it.... i feel like i rambling. sigh",Schizophrenia Spectrum & Psychotic Disorders,Anxiety Disorders,Neurodevelopmental Disorders,Psychotic Disorders,Ptsd Spectrum,Bipolar Disorders,Schizoaffective Disorder,Body Dysmorphic Disorder,Sleep Apnea
19090,hydroxyzine constantly,"hey guys. i suffer from panic attacks daily, sometimes multiple times a day, and nocturnal panic attacks as well. i take hydroxyzine 25 mg, and i take it as needed, but my panic attacks are so constant and severe, that i pretty much have to take them each time i'm having one. i do have health anxiety and so i worry about my heart and all that, i was just wondering maybe if you guys raw dog it and let the panic attacks just hit full force, or if you take something to help you? am i doing too much with the hydroxyzine? it's the only thing i have rn for my panic attacks since i can't take antidepressants yet due to some weight issues i've got going on. thanks edit fixed spelling errors, sorry",Anxiety Disorders,Mood Disorders,Schizophrenia Spectrum & Psychotic Disorders,Panic Disorders,Cluster A (Odd/Eccentric),Insomnia Spectrum,Panic Disorder,Adjustment Disorder,Hoarding Disorder
14551,sleep depriving myself to feel different,so its my first post on here. i have a drug history and am sober 6 months now from spice and weed and i still drink here and there. i also got my dph sleep meds but they ran out a couple of days ago and i just started to stop sleeping to feel some sort of high i guess. idk i think about getting high all day almost and i also have sleep problems with falling asleep in the first place (therefore spleep meds) and the only thing i can think of gets me some sort of high is being extremely sleep deprived so im all for it. i know this is unhealhy but im so down bad to feel kind of out of my mind its the only thing i can do. i also have multiple ploblems like depresson derealisation and so on diagnosed also in therapy for all that but that honestly doesnt seem to help. i really just wanna know if theres someone else trying this or some advice like idk ive been thinking of just starting woth smoking weed again to help but im unsure about that cause ive had multiple psychotic episodes since spice which is why ive quit everything psychoactive. i hope this is not the wrong sub and if theres any one with more experience willing to share im thankful in advance,Sleep Disorders,Personality Disorders,Obsessive-Compulsive & Related Disorders,Insomnia Spectrum,Panic Disorders,Substance Use Disorders,Insomnia,Anorexia Nervosa,Schizoaffective Disorder
20309,i got into my dream university,"hi everyone, i ve always wanted to me a psychologist, i don t know why but i d like to think it s because i want to help people who are like me. and when my pdd was at it s worse i tried to commit suicide and was hospitalized in january to february 2024. it s been a long hard road, i ve been on medication (prozac) and been seeing my therapist, and i ve been pushing myself. last month i got the push to apply to my dream university and i ve been so anxious thinking i won t get in and i did. i m so proud of myself. i m finally going to follow my dream.",Mood Disorders,Substance-Related & Addictive Disorders,Schizophrenia Spectrum & Psychotic Disorders,Depressive Disorders,Psychotic Disorders,Insomnia Spectrum,Persistent Depressive Disorder (Dysthymia),Social Anxiety Disorder,Insomnia
9722,am i still in an episode?,"i m 17 and have dealt with hallucinations and delusional thoughts for a few years now (they have gotten worse as times went on. few weeks ago one of them started the sleeping. i slept constantly, i couldn t stay awake it didn t matter if i had 5hrs or 15hrs i felt tired all the time and couldn t talk to my friends. after around 2 weeks of this i suddenly was always awake. i had 247 energy and felt like something was missing from me that i needed in order to change and grow as a person. i started cleaning, animating, making clothes, piercing myself, cutting my hair, every night out of trying to find what was missing. depression. after a week of not sleeping i got very depressed. i was mentally slow and wanted to end my life. this lasted two days. i went to the shop to get pills when all of a sudden my friend got hit by a car near by and i left instead to find her. after this the depression and sadness wore off. the thoughts after 2 weeks of crap sleeping and not finding what this mystery thing i was missing i thought i figured it out. outside my room i thought aliens were watching me, guarding over me protecting me like angels. i had a vision of me with these aliens happy and content and had this in my mind that that was what was missing. i had to kill myself so i could become an alien and be happy with them. i then made plans that night to go to the shops and buy pills, what time i was going to take them the whole plan. i then went to the shopping centre to get them and thought i m gonna die so i m gonna do everything i ever wanted becoming an alien i started buying 100s worth of clothes and piercings and then went to the toilet, i looked in the mirror and saw me, myself as an alien. i felt like i didn t need to kill myself anymore because i am now an alien on earth. i felt so happy. i found what was missing and was so happy. after that night i made animations about the aliens and recognised that this might have been an episode. i then went to sleep and slept for 14hrs, woke up and felt better in myself the obsession one thing was different when i woke up though. i still felt like an alien, not literal but in an obsessed child sort of way. i started buying eye contacts, 100s of space dolls, starting making clothes that i thought where alien like in my head. i couldn t sleep again. i started cleaning again constantly since i couldn t sleep. i was happy being this alien way and recognised i was before in an episode and now out of it. now i was just having fun. the dream. last night i had a dream that someone broke into my house, i searched each room and saw aliens on my bed in the darkness. they were clear versions of what these aliens looked like to me like the ones before speaking to me. they screamed at me and i threw a weird ball at them. they screamed at me again and collapsed into nothing. i ran out the window and saw another. this alien was tall, thin and powerful just standing on a hill by my house. i stared at it and it screamed (like those minecraft endermen lol) and then i must ve died because the last thing i saw before i woke up was the alien screaming close to me. what is it? i now wonder am i still in an episode, is this some weird obsession or still part of the episode?",Schizophrenia Spectrum & Psychotic Disorders,Personality Disorders,Obsessive-Compulsive & Related Disorders,Psychotic Disorders,Cluster B (Dramatic/Emotional),Depressive Disorders,Delusional Disorder,Dependent Personality Disorder,Histrionic Personality Disorder
1836,anyone else start feeling sad symptoms as early as fall?,"sad occurs due to lack of sunlight but i found that even on sunny days when the weather starts to get colder in the fall, i definitely feel a dip in my mood. i wonder if it s because i ve just come to link the depression with cold weather since that s when the days shorten. or i m just extra sensitive to the days beginning to be noticeably shorter does anybody have a similar experience or any thoughts?",Mood Disorders,Obsessive-Compulsive & Related Disorders,Substance-Related & Addictive Disorders,Depressive Disorders,Ocd Spectrum,Substance Use Disorders,Seasonal Affective Disorder,Narcissistic Personality Disorder,Cyclothymic Disorder
872,afraid and tired of struggling,"i'm on here to try and find community and support. i started having panic attacks as a teen but i never knew what it was. my parents wanted to pray it away but only about 6 years ago i realised what it was. i'm 36 now, mom to 3 kids, and the last few months my panic attacks have taken over every day for me. even if i'm not having one the fear of the next one cripples me. i started studying today, a part time course, and i have a business it all feels like a lot, but i know i can do it. but the moment my panic comes up i just feel so defeated. i'm also autistic. i'm on ssri's and i have urbanol if it gets really bad. but the urbanol makes me tired and then i cant workstudy. i've been in therapy for years, i've started tre as well i just feel really discouraged and afraid that this will be my life...",Anxiety Disorders,Eating Disorders,Obsessive-Compulsive & Related Disorders,Panic Disorders,Cluster B (Dramatic/Emotional),Autism Spectrum Disorders,Panic Disorder,Generalized Anxiety Disorder (Gad),Obsessive-Compulsive Personality Disorder
20343,i had a little win,"i just started a path to healthy eating. my wife expressed concern for my health, a lack of drive and maybe depression. she expressed it was hard for her to see me the same and i changed since we met for the worse. she said it all tastefully and from a place of genuine concern. it was eye opening but painful. i don't want to live without enjoying desserts socially so i set a hard, fast rule one serving, only with people, only homemade or quality crafted desserts from a bakeryrestaurantice cream shop, etc. just enjoy the treat socially like a normal human. no seconds. no breakroom donuts, no gas station plastic wrapped garbage. any way, i had a social gathering today and there was brownies. i had one and they were so good but even though i wanted 12, i had one. one. it doesn't feel like much, but it's better. feels big to me. i think i can do this. i'm not counting calories to lose weight, im focusing on health. i've been eating real foods and indulging on desserts healthily.",Eating Disorders,Obsessive-Compulsive & Related Disorders,Sleep Disorders,Restrictive/Compensatory Disorders,Adhd,Cluster A (Odd/Eccentric),Binge-Eating Disorder,Panic Disorder,Histrionic Personality Disorder
3030,do any of you actually have good parents?,"every person i know with autism or a similar disorder seems to have bad parents. my parents support me financially but they yell a lot, don t take my feelings seriously and didn t do enough to advocate for me in school or help me succeed as an adult. they also held me responsible for the behavior of my autistic younger sibling. one of my parents frequently tells me, as an adult, about how i was so difficult as a toddler like they still resent it. my difficult behavior wasn t even that difficult, i was hyperactive and interrupted breastfeeding, i wasn t running away or getting into fights or anything. all my friends have even worse parents than this. internet groups for moms of autistic people seem to be full of bad people. some are good people but it really seems like there s a lot of narcissists, ableist people, and people who don t take the disorder seriously. so i m wondering if anyone actually has good parents and what they did to accommodate your disorder.",Neurodevelopmental Disorders,Eating Disorders,Trauma & Stressor-Related Disorders,Autism Spectrum Disorders,Panic Disorders,Generalized Anxiety Disorder,Autism Spectrum Disorder (Asd),Schizoid Personality Disorder,Delusional Disorder
16847,extreme brain fog is making me terrible at my job,i ve made so many small mistakes and stirred people up because of how god damn incompetent ive become at my job. i need to call someone to fix a problem and i just call the wrong numbers. protocol is to notify higher ups if standby doesnt pick up. so i threw somebody under the bus over my mistake and it caused an email war. i touch things and make changes that im not supposed to. they send us updates over email and i read them but the information just seems to leave my mind immediately after and i fuck up again. i just need a break so bad but we dont have people to cover unless we force someone into overtime. then i just ruminate on my mistakes for the whole hour drive tofrom work without fail. its a blue collar job anyway so id probably get laughed out of the room asking for time off,Mood Disorders,Eating Disorders,Neurodevelopmental Disorders,Bipolar Disorders,Phobias,Cluster B (Dramatic/Emotional),Bipolar 1 Disorder,Delusional Disorder,Autism Spectrum Disorder (Asd)
18445,happy st patrick s day at 16 years sober.,"hello all and happy st patrick s day. today i have been sober for 16 years. over that time i made myself some guidelines to help and remind me of what i need to do. just having the perspective and written down rules has helped me. 1. you have to want to quit. all the selfhelp books and all the support groups in the world are not going to help you if you don't actually want to quit. 2. find a reason to quit. any reason outside of yourself that can make you accountable. start small and build from there. responsibility can be a hell of a driving force when it s something you care about. 3. redirect the the urge to something beneficial. as an addict i have the superhuman ability to pour all of myself into something that gives me joy. replacing the bad behaviors with something improves your current situation can help while keeping you busy. 4. never get bored. i'm a machine of habit when i get bored i get back into whatever habit that's easiest for me. building new habits takes time don t give up. 5. if needed remove the people and things that allow you to continue the addiction. this one sucks. it hurts to lose someone that was close to you but when the people around you aren't helping you, or in some cases actively hurting you, then you need to think about what you really need to do and sometimes that means cutting people out. this goes for physical locations and inanimate objects as well. 6. find anything that works for you. what works for you may not help someone else. what works for me might seem alien and totally unreasonable to somebody else but as long as it keeps me clean then that's what i need to do. 7. get help if you need it. you don't have to do this alone. if you feel yourself falter or begin to fail there are thousands of people that know how to help and might even know exactly what you are going through. you just have to look. 8. it doesn t all have to be the perfect. you can still be a mess and be sober. everyday sober is better even if you aren t the best. at least you know you re trying. sooooo ., i had to invoke my fifth rule this last year. i quit my job. without going into the nitty gritty of it all i worked at a smaller business of about 5 people total and to put it mildly they were not sober. i loved that job. i liked the guys i worked with but it became clear to me that they were not healthy for me to be around. one of them may even have been dealing. needless to say as soon as i found out the extent of the substance abuse going on behind the scenes i left the next day. it all turned out for the better. i got a new job with less toxic people and i m much happier here than the four years i was at my other job. it can be rough sometimes. it may even seem impossible but you will still be better without the people that destroy you and simply do not care about you. from my experience narcissistic and addictive behaviors tend to come together in the more extreme cases of abuse and you may not even be aware of it until after you ve removed them from your life. it is important to take stock of the things around you and regularly check if it s healthy and helpful. otherwise you get stuck in your patterns again and it is so damn hard to get out of them. sorry for the word vomit but i think it was important for me to at least talk about following my own advice. you are all awesome. you can do this. never get bored and never stop. good luck to all of you and happy st. patrick's day",Substance-Related & Addictive Disorders,Schizophrenia Spectrum & Psychotic Disorders,Obsessive-Compulsive & Related Disorders,Substance Use Disorders,Generalized Anxiety Disorder,Cluster A (Odd/Eccentric),Alcohol Use Disorder,Social Anxiety Disorder,Avoidant Personality Disorder
