id,Title,Body,Category,Category_2,Category_3,Subcategory,Subcategory_2,Subcategory_3,SpecificDisorder,SpecificDisorder_2,SpecificDisorder_3
13837,sad?,not sure if i got sad as i get the depression in daylight and as a result am a night owl. i feel like doing nothing have no energy and count down hours till dark do i can be happy again. if this is das ( reverse sad ) if that's even an official thing. been suffering for years with this now. any help insite would be greatly appreciated,Mood Disorders,Anxiety Disorders,Personality Disorders,Depressive Disorders,Cluster C (Anxious/Fearful),Adhd,Seasonal Affective Disorder,Schizoaffective Disorder,Anorexia Nervosa
15857,does anyone else sometimes find neurodivergent people unfortunately hard to handle because of your own autismneurodiversity?,"i don't mean this to be negative, but... a lot of nd people talk about getting along with other nd people way better. and in a lot of ways, i do too. as far as personality, sometimes having similar views, and things like that, i often feel more comfortable with some other nd people. but at times, i find it extremely hard to deal with being around some nd people, and i hate that it's that way. my nervous system doesn't deal well with people around some people with adhd, or some autistic people at times. it's not that i'm trying to mentally, consciously judge them or anything, it's that it's just very overwhelming on my mind and nervous system, in a different way than being around other people is. it can make me irritable even when i want so badly to be able to be a nonjudgemental understanding person for those people. i have an also autistic family member, who i have just often found it very hard to be around. my nervous system is always so shot, trying to process the world around me and everything. maybe even because of the way i learned politeness and social norms in a rigid way, the particular way that he's so often ""rude"" (maybe unintentionally, but still), not great with boundaries, or socially unaware just triggers something like fight or flight in my brain and nervous system, to where i literally just can't think straight and feel the need to get away. which makes it extremely hard when i'm living in the same house with him right now. and it's like this with a couple of other family members who have adhd, too. mentally, consciously, i want to be an understanding, kind, patient person for them. but it feels like sometimes my brain and nervous system just override that and it's so hard to be around them, especially while trying to be cheerful and calm and friendly, while i feel the sensory overwhelm and my nervous system feeling like it's being wrung out. and i just know, if i didn't have a brain and nervous system that were frayed to bits and struggled to hold it together all the time, it wouldn't be so hard. or shit, the way i'll randomly go through spells where i'm significantly calmer and just not as bothered by it if i could be like that always, i could deal. but so often it's like my nervous system overrides my mentalconscious wanting to not get overwhelmed or otherwise uncomfortable from them. again i don't want to be negative, and i'd hate the thought of someone reading this and internalizing it. i'm not hating on other neurodivergent people for being... neurodivergent. it's just a thing where the way my brain's wired i think makes certain things extra hard to deal with from certain people, and it's like i have this idea that i'm supposed to be extra tolerantget along with all nd people extra well...so i beat myself up for not being able to deal with it perfectly. idk.",Neurodevelopmental Disorders,Eating Disorders,Mood Disorders,Autism Spectrum Disorders,Generalized Anxiety Disorder,Ptsd Spectrum,Autism Spectrum Disorder (Asd),Seasonal Affective Disorder,Sleep Apnea
19020,haven t slept for 24 hours,"i am so sleep deprived and haven't slept for 24 hours and having to go to work feels so horrible. i'm so fatigued but unsure why i can't sleep, now i have to go to work at 7am which is in 30 mins for a 12 hour shift. i am a nurse and i do night shifts as well. ive gone to the gp and they recommended me restavit and melatonin, nothing is working. what s helping you sleep well at night?",Sleep Disorders,Mood Disorders,Substance-Related & Addictive Disorders,Insomnia Spectrum,Psychotic Disorders,Ptsd Spectrum,Insomnia,Schizoaffective Disorder,Hoarding Disorder
4651,how do you perceive other people?,"generally speaking, what emotions do others invoke in you? are people more like ""inanimate"" objects, in that they are ""neutral"", or, are they a source of energy, either positive or negative? take this example you are chilling on a park bench and someone asks if they can come and sit next to you. would you be bothered by their presence, indifferent, or see it as an opportunity?",Personality Disorders,Obsessive-Compulsive & Related Disorders,Trauma & Stressor-Related Disorders,Cluster A (Odd/Eccentric),Panic Disorders,Autism Spectrum Disorders,Schizoid Personality Disorder,Generalized Anxiety Disorder (Gad),Cyclothymic Disorder
12109,panic attacks prepost antidepressants,"i started on sertralinepropranolol to help with depression, anxiety and panic attacks and in the 18months i was on them, i didn t have one attack. i ve now stopped the medication (after tapering off in line with my doctor s advice) and the panic attacks are back worse than before. does that mean i ll need to back on the meds permanently? has anyone had similar?",Anxiety Disorders,Substance-Related & Addictive Disorders,Sleep Disorders,Panic Disorders,Bipolar Disorders,Autism Spectrum Disorders,Panic Disorder,Schizoaffective Disorder,Insomnia
10766,burning sensation?,"hey all, just wondering does anyone else get a burning sensation in their head during panic attacks and then like tenderness where it originates from? it's the back of the head (crown). if anyone does andor has a link to a fight or flight diagram with this on i'd be super grateful, as i can't find one with it on. em",Anxiety Disorders,Personality Disorders,Schizophrenia Spectrum & Psychotic Disorders,Panic Disorders,Phobias,Substance Use Disorders,Panic Disorder,Insomnia,Generalized Anxiety Disorder (Gad)
15972,does anyone get rage?,currently in pennsylvania where it s grey grey grey grey grey grey grey. of course i m having the usual depression era but recently the rage and annoyance has been over the top. like people were walking slowly in front of me and i was fighting demons to not scream at them to get out of my way. anyone else have this problem?,Mood Disorders,Substance-Related & Addictive Disorders,Sleep Disorders,Depressive Disorders,Phobias,Cluster B (Dramatic/Emotional),Seasonal Affective Disorder,Adjustment Disorder,Dependent Personality Disorder
11757,my girlfriend suffers from bdd how can i help?,"my girlfriend is the most beautiful woman in the world. of course, she does not see it this way. we constantly struggle with her bdd, and it makes me sad to see her so sad. i know there probably isn't much i can do personally to help, but i am hoping there is something i can do to at least make it easier for her.",Obsessive-Compulsive & Related Disorders,Neurodevelopmental Disorders,Sleep Disorders,Ocd Spectrum,Panic Disorders,Bipolar Disorders,Body Dysmorphic Disorder,Antisocial Personality Disorder,Attention-Deficit/Hyperactivity Disorder (Adhd)
20330,i guess being chronically tired and having to nap multiple times a day has its perks?,"i stumbled across a study about narcolepsy and was intrigued by the way it described narcoleptics as having ""privileged access to rem sleep"". i had never thought of it as a privilege, but i'll take it lol. this study examined levels of creativity in subjects with narcolepsy vs. subjects without, and guess what guys, we're creative yeah maybe we sleep through our whole lives and thus can't do much with that creativity, but the potential is there. honestly that gives me a lot of hope. httpsacademic.oup.combrainarticle142719885506053",Sleep Disorders,Obsessive-Compulsive & Related Disorders,Schizophrenia Spectrum & Psychotic Disorders,Insomnia Spectrum,Substance Use Disorders,Bipolar Disorders,Narcolepsy,Sleep Apnea,Post-Traumatic Stress Disorder (Ptsd)
22208,join agoraphobia haven a safe and supportive discord space,"hi everyone if you re looking for a welcoming and safe place to connect with others who understand agoraphobia and anxiety, i d love to invite you to my discord server, agoraphobia haven. created in august 2024, this server is a judgmentfree space where you can share your experiences, find resources, and build connections. what we offer emotional support daily activities like questions, celebrations of progress and calls to help each other go outside safe spaces for chats and voice calls helpful resources for anxiety and agoraphobia everyone with agoraphobia is welcome join us here httpsdiscord.ggvgqmqsjzdz you don t have to face this alone. let s support and help each other",Anxiety Disorders,Eating Disorders,Neurodevelopmental Disorders,Phobias,Cluster B (Dramatic/Emotional),Depressive Disorders,Agoraphobia,Generalized Anxiety Disorder (Gad),Panic Disorder
16648,every social interaction i have feels unfulfilling,"i'm not even sure how to explain this but every i socialize (it's been happing less and less often), i leave dissatified and feeling empty. it's like there's a wall preventing me from fully connecting with the other person, i always end up feeling worse about myself and like i'm barely human. i find it hard to care about the things people have to say, even people i like and care about. i'm so easily bored even tho their lives are way more interesting than mine so idk if this has something to do with the tism or maybe it's depression.",Neurodevelopmental Disorders,Personality Disorders,Eating Disorders,Autism Spectrum Disorders,Cluster A (Odd/Eccentric),Ptsd Spectrum,Autism Spectrum Disorder (Asd),Insomnia,Histrionic Personality Disorder
648,addiction,"for those who have problems with addiction, what are you addicted to and how do you manage it? i've always been addicted to something, sex, shopping, weed, pcp, alcohol, adrenaline, stealing, etc. it starts off pretty innocent, like most addicts, but always devolves until i have to stop myself coldturkey and then start up again on the same substance or a new one. i've learned to accept that i will always be addicted to somethingcantdon't want to change. so i worked a lot on impulse control and learned how to have my vices in moderation and in moderation only. curious on how others manage.",Personality Disorders,Trauma & Stressor-Related Disorders,Anxiety Disorders,Cluster B (Dramatic/Emotional),Ocd Spectrum,Cluster C (Anxious/Fearful),Antisocial Personality Disorder,Paranoid Personality Disorder,Cyclothymic Disorder
11578,"my colleagues and i were discussing vacations, and i jokingly said that i need a vacation from existence. no one understood me.","they literally didn't understand what i meant at all. and they looked at me as if i had said something in a foreign language. then one of my colleagues asked me ""in what sense? what is a vacation from existence?"". ... i honestly don't understand what is unclear here and why it needs to be explained.",Personality Disorders,Substance-Related & Addictive Disorders,Sleep Disorders,Cluster A (Odd/Eccentric),Psychotic Disorders,Cluster B (Dramatic/Emotional),Schizoid Personality Disorder,Seasonal Affective Disorder,Schizoaffective Disorder
6800,"in college, no friend group, very few friends who i see rarely what can i do","not trying to have pity on me or anything, i just want advice, i'm 17 and pretty much i have no consistent friends,as in people i see more than once or twice a month, which means it's really common to go a week or two without properly talking to anyone outside of immediate family, i'm trying to be friendly with others in school but it seems that people already have friend groups and don't want to take me in. i have no idea what to do, i'm pretty lonely and pretty much have nothing to do on weekends or whatever",Neurodevelopmental Disorders,Personality Disorders,Anxiety Disorders,Autism Spectrum Disorders,Insomnia Spectrum,Ptsd Spectrum,Autism Spectrum Disorder (Asd),Panic Disorder,Restless Legs Syndrome
11673,my experience with quiviviq (as female on oral birth control),"i am using a throwaway for this because i'm revealing personal information and don't want to doxx myself... i've had insomnia for over a decade and i am dealing with it more or less. i've been taking trazodone 75mg for years now and that helps me to fall asleep, but unfortunately i wake up around 25am (i fall asleep around 1011pm) often and have trouble falling back asleep. when that happens, i take triazolam, which is a benzo with a short halflife so i'm not hungover the next day. but i also have valium which i sometimes take. i am tracking how often i use benzos because i don't wanna overuse, and it's about 34 days per week. i have heard about the new drug class dora and thought this would be perfect for me, so i got it prescribed (and had to pay a fuckton of money for a package) and started taking 25mg about 10 days ago. and it really helped me stay asleep i still had to take 50mg of trazodone to fall asleep, but with quviviq i slept all night and got up at 7 completely refreshed. feeling this natural state of tiredness was a bliss, i would wake up for a second and then just turn around and fall back asleep. though over the course of the following week, some concerning things happened first, i am also on oral birth control (drovelis or nextstellis, which is estretol and drospirenone). according to the information i found online, there should be no major interactions. daridorexant (quviviq) is a weak cyp3a4 inhibitor, so it might increase drospirenone, since that is the enzyme that breaks drospirenone down. which might increase side effects of drospirenone, but shouldn't be too big of a problem, or so i thought. though a few days into taking quviviq i started spotting, which then progressed into a breakthrough bleed as strong as a menstruation, accompanied by cramps which i normally never experience. i don't know whether this means that somehow those medications might be interacting in a way that the birth control loses its effect, but i reduced quviviq to 12,5mg (which didn't stop the bleeding) and completely stopped yesterday. today it seems the bleeding stopped, so i'm quite sure it is quviviq. i'm quite disappointed that this doesn't seem to work for me, but i just wanted to share my story for anyone who is maybe experiencing the same, since i haven't found anything about doras with oral birth control. what is now a bit weird is that i have a tinnitus since yesterday. i felt that my ears were ringing since i started quviviq, but it was nothing major so i ignored it. today the tinnitus is definitely there and it's annoying. i hope this will also subside after a few days off quviviq. also, i do have headaches quite often and i definitely had to take a lot more pain killers while on quviviq. so i would have loved for this medication to work because i slept sound, but it definitely interacts with my birth control and i can't keep on taking it. maybe anyone on birth control can share their experiences taking quviviq or any other dora (belsomra, dayvigo). for me, i guess it's back to trazodone and benzos as needed, which sucks but i don't see any other way for now.",Sleep Disorders,Anxiety Disorders,Obsessive-Compulsive & Related Disorders,Insomnia Spectrum,Adhd,Autism Spectrum Disorders,Insomnia,Obsessive-Compulsive Personality Disorder,Bulimia Nervosa
17666,forced pattern recognition,"i'm not sure if there's a better word for this but i was listening to this random podcast and something clicked for me. most thinkers or system developers or ""influential historical figures "" be they agents of ""evil"" or ""good"", regardless of which, seem to arrive and arise at the specific time they are needed. as though guided by a specific will, which i guess is besides the point to mention but whatever. maybe it's relevant. there has to be a person almost as a vessel for the information required to ""rise to power "" in a nietzchian sense, or as he sort of played with at the end of his life ""the will to information"", in his discarded notes (real thing check it out). placing that person, is likely an act of nature and genetic luck though we like to romanticize it as destiny, the evidence leans strongly toward genetic determism.. but my rambling point is that these system builders or agents of change and influence all meet a substantial resistance in their environment which requires attention and problem solving. a psychologically stable individual will look at these problems if they are apt to deal with the information and consistently build on it as though some form of ""genius ""however, what if a person is subjected to substantial impairments in childhood? then pattern recognition, the ""problem recognition "", begins at a young age. the will to power or whatever it is, goes through or around the obstructions, almost always a combination of abusive and neglectful caregivers and neglectful environment. the days become years and this pattern recognition grows just as an economics genius or math genius would except in this case it's highly specialized to certain environmental cues that later in life and not often present (though this does explain why people try to control their trauma by reinforcing it) there's debate about whether this program, redundant and negative often in its outcomes, can be resolved at any or all levels , especially i wonder about biological levels, in other words if one can become conscious or as conscious as possible of their own mistplaced and almost foundational to self and existence pattern recognition their ""paranoia"", that they can also ""cure"" or experience full biological health, considering that often people with schizo spectrum disorders went through key developmental years with those traits already ""dormant"", so to speak. i am left to wonder if the information and pattern recognition itself is just a source of continuous suffering one can cut themselves on over and over, a way to soothe ones self to sleep at night or an impossibly tangled mess that will always impede spirit and the ability to breathe and feel connected to reality. my belief is that the physiological damage is permanent and we can only work with the symptoms of it, reducing them and improving positive factors, with significant back and forth in quality of life due to the root bioglical ""corruption "", that isn't functioning correctly.",Personality Disorders,Anxiety Disorders,Obsessive-Compulsive & Related Disorders,Cluster A (Odd/Eccentric),Autism Spectrum Disorders,Substance Use Disorders,Schizotypal Personality Disorder,Post-Traumatic Stress Disorder (Ptsd),Social Anxiety Disorder
10245,blood pressure fear tw,"hello i ve been dealing with panic disorder since mid 2022. in august 2024 i had a relapse and i ve been hardly working on it since it happened with a new therapist who is an agoraphobia, gad and panic disorder specialist. when i had the relapse, it happened while in my family s car outside church. i had my bp going high when i wasn t even feeling anxious so that made me really scared and didn t want to go back to church anymore. i kinda got over it and i got able to go back again last sunday i measured my bp when we were in the car before going to church. i kept measuring it at every red light and it didn t go back to normal. did it again at church and got higher so i freaked out and ask my family to please leave cuz i was having high bp. my mom told me cruel stuff such as ""the devil is using you"" and many other ugly things that made me feel traumatized then when we got home, the church s service was being broadcasted and the pastor was actually talking about anxiety and me, as a believer, i do believe god put that in his heart (and the pastor also said that) when we got home, my older brother said that the devil knew the pastor was gonna talk about it so he took me out. to be honest that traumatized me cuz when i was scared of going to church was because i felt like god was punishing me for not being straight. these days every time i m going out i m feeling uncomfortable again and to be honest, it makes me feel frustrated because of all the hard work i ve put into getting better, but what makes me terrified the most is thinking that i am going to church again this sunday and i don t wanna feel bad again, fearing bp and hr. i can really express this to my mother cuz honestly she gets mad at me. english is not my first language and i would really appreciate some advice (i m doing therapy today but would love advices from you)",Anxiety Disorders,Neurodevelopmental Disorders,Schizophrenia Spectrum & Psychotic Disorders,Panic Disorders,Substance Use Disorders,Cluster B (Dramatic/Emotional),Panic Disorder,Obsessive-Compulsive Disorder,Attention-Deficit/Hyperactivity Disorder (Adhd)
7453,my psych wants me to try cymbalta (duloxetine) and i'm scared to...,"i should probably preface this with the fact that i'm not formally diagnosed with anything, but my symptoms have been consistent with cyclothymia (possibly bp2). i'll fall into a depressive state for a week or two, then swing back to normal, then be way too up for a few days. i brought this up as an initial concern with my gp and my psych, and was prescribed prozac first, which did not make me feel better in the slightest. if anything, i felt worse, and it probably induced a couple of hypomanic episodes that i had back in novdec. i fell into a depression so bad i considered hospitalizing myself, and stopped taking it not long after. a few months ago, i was prescribed 150 mg of wellbutrin (bupropion), and thought it was working until i started having anxiety so bad i wouldn't sleep for 23 hours a night, had borderline panic attacks, migraines, and my mood was fluctuating from hour to hour. i stopped taking it a couple days ago and i already feel better, but i'm worried it's a hypomanic episode based on how i'm behaving and how fixated i am on my symptoms. my psych prescribed me cymbalta for me to try. it's the lowest dose, and she assured me that giving it a try should be okay, but stories i've heard (especially from those with some form of bipolar) do not exactly inspire hope within me that i'll be fine when on it. part of me wants to say fuck it and see how it affects me, hoping the answer will be ""badly"" and she'll finally tell me i can try a mood stabilizer, which is something i think i've needed for months. i don't know what to do. i'm scared i'll crash and i won't be able to function without something influencing my mood. i'm worried i'm wrong in thinking i have cyclothymia. i'm worried about what will happen if i try an snrii don't want to induce an episode. it's frustratingi don't feel like she's listening to me, but i'm not the professional in this situation. have any of you had an experience like this? should i try it?",Mood Disorders,Eating Disorders,Trauma & Stressor-Related Disorders,Bipolar Disorders,Ptsd Spectrum,Insomnia Spectrum,Cyclothymic Disorder,Attention-Deficit/Hyperactivity Disorder (Adhd),Insomnia
755,advice for grad student (but mostly a rant),"hi everyone tldr i am falling behind in all my work and feel like i have no time or energy for it. the quality of my work is suffering and i feel guilty for not having things done. i feel like i m just barely getting by. help pls i m a fulltime grad student and work as both a graduate assistant and tutor on campus. lately i am really struggling to keep up with my work. i m diagnosed with type 1 narcolepsy and adhd (though sometimes i think it might just be one mirroring the other), so i really struggle to focus on my work and constantly procrastinate. it s just like i m going through the motions to get through the day, then by the time i get home and makeeat dinner i am completely exhausted and it s already like 9pm. it also doesn t help that i barely have any time to eat until then. at that point i am just sitting on the couch trying to bring myself to do work, but i am so mentally and physically drained. i used to just fall asleep in these situations then i could maybe do some work after a nap (though usually it was like 20 min nap, 20 min of work so not very productive). now, idk if it s because i m medicated or what but i don t really fall asleep instead i just feel like i m paralyzed and then i feel like shit for not doing anything. this lasts hours. by the time i get myself up, it s one of two things 1. i get to work at like midnight then i m up super late trying to finish but pretty much inevitably fall asleep during it or 2. i go to bed and tell myself i ll get up early to finish (even though i know i won t be able to). either way, my sleep schedule is fucked and i get next to nothing done. i just feel so guilty, especially in group projects. and in grad school now all my classes are only a few people so i can t even fake my progress then get everything done at the last minute, which has always been my specialty. though, even that was becoming difficult to manage. any advice on how to deal with any of this?",Sleep Disorders,Neurodevelopmental Disorders,Personality Disorders,Insomnia Spectrum,Restrictive/Compensatory Disorders,Psychotic Disorders,Narcolepsy,Generalized Anxiety Disorder (Gad),Bipolar 2 Disorder
